{
  "$schema": "https://json-schema.org/draft/2020-12/schema",
  "$id": "urn:grid-coordination:urpx-rate-plans:schema:corpus:v1",
  "title": "Corpus layout descriptor",
  "description": "How to walk this corpus. Each kind's include globs are relative to every root, or to the kind's own roots when it lists them. A walker's CLI, run from the repository root, prints repo-relative POSIX paths one per line in C-locale byte order: with no arguments the files of the kinds listed in documents, with kind names as arguments the files of those kinds, and with --all every kind as kind<TAB>path.",
  "type": "object",
  "required": ["corpus", "roots", "kinds", "documents", "walkers"],
  "additionalProperties": false,
  "properties": {
    "$schema": { "type": "string" },
    "corpus": { "type": "string", "description": "Name of the corpus." },
    "roots": {
      "type": "array",
      "minItems": 1,
      "items": { "type": "string", "pattern": "^[^/*]+$" },
      "description": "Top-level directories the include globs are evaluated under."
    },
    "kinds": {
      "type": "object",
      "minProperties": 1,
      "additionalProperties": {
        "type": "object",
        "required": ["include"],
        "additionalProperties": false,
        "properties": {
          "description": { "type": "string" },
          "media_type": { "type": "string" },
          "roots": {
            "type": "array",
            "minItems": 1,
            "items": { "type": "string", "pattern": "^[^/*]+$" },
            "description": "Top-level directories this kind's globs are evaluated under, in place of the corpus roots."
          },
          "include": {
            "type": "array",
            "minItems": 1,
            "items": { "type": "string" },
            "description": "Globs relative to each of the kind's roots. * matches within one path segment; ** matches across segments."
          }
        }
      }
    },
    "documents": {
      "type": "array",
      "minItems": 1,
      "items": { "type": "string" },
      "description": "The kinds that make up the corpus documents, i.e. what a consumer loads."
    },
    "walkers": {
      "type": "array",
      "minItems": 1,
      "items": {
        "type": "object",
        "required": ["language", "path", "cli"],
        "additionalProperties": false,
        "properties": {
          "language": { "type": "string" },
          "path": { "type": "string", "description": "Repo-relative path of the implementation." },
          "api": { "type": "string", "description": "In-language entry point." },
          "cli": { "type": "string", "description": "Command run from the repository root." }
        }
      }
    }
  }
}
